{
  "contact_id": "a1b2c3d4-e5f6-7890-abcd-ef1234567890",
  "first_name": "John",
  "last_name": "Doe",
  "email": "john.doe@example.com",
  "phone": "+1-555-123-4567",
  "mobile": "+1-555-987-6543",
  "birth_date": "1985-03-15",
  "address": {
    "line1": "123 Main Street",
    "line2": "Apt 4B",
    "city": "San Francisco",
    "state": "CA",
    "postal_code": "94102",
    "country": "USA"
  },
  "created_at": "2024-01-15T10:30:00Z",
  "updated_at": "2024-06-20T14:45:00Z",
  "source": {
    "platform": "dataverse",
    "platform_version": "v1"
  }
}
